{
  "schema_id": "cartulary.graph_projection_restore_implementation_binding.v2",
  "algorithm_id": "graphprojection.restore_rebuild.v2",
  "binding_id": "graphprojection.restore_rebuild.network_flow_graph_views.v2",
  "graph_projection_contract_id": "cartulary.graph_projection_nlspec.v2.0.0",
  "recovery_state_catalog_sha256": "ce0a1f4053a9ce156273e4adf40c8b4185fa616170eadd6a860500d0b24fd22f",
  "source_registry_sha256": "e75697ef1f6b5a197d299746fd42d2bf07afcd2e1c9d187a6fe695bca3096730",
  "graph_table_ids": [
    "graph_projection_result_edges",
    "graph_projection_result_leases",
    "graph_projection_result_vertices",
    "graph_projection_results"
  ],
  "graph_engine_algorithm_ids": [
    "graphprojection.deterministic_projection.v2",
    "graphprojection.input_admission.v2",
    "graphprojection.restore_publication.v2",
    "graphprojection.result_identity.v2"
  ],
  "graph_engine_algorithm_digests": [
    "617737e782ac5cb310e2039ac9cc1985021242f2137ec6d5b631b4d6cd99ec7e",
    "de914d247eba75b55da0acbb2da9756d254f3cb211208deb3b7140e4492db1e5",
    "d6156c095ead7008c926ddb701235048fa6f348344fd9d1cba9c48e2e3028dde",
    "0e5c9912a7b29389da18edbb2e8aa1e8eeb454ca9464b16a1acf3e37248d5033"
  ],
  "database_schema_lineage": "cartulary.prod_ddl_rebaseline.v2",
  "database_schema_head": 33,
  "packaged_subject_sha256": "3333333333333333333333333333333333333333333333333333333333333333",
  "build_provenance_sha256": "4444444444444444444444444444444444444444444444444444444444444444"
}
